{
  "version": "0.1",
  "map": {"id": "sample_stunt_valley", "name": "Sample Stunt Valley", "units": "unity"},
  "Start": {"x": 0, "y": 1},
  "End": {"x": 74, "y": 4},
  "Top": {"x": 49, "y": 9},
  "Bottom": {"x": 40, "y": -1},
  "deadzone": [
    {"id": "ravine_01", "closed": true, "points": [{"x": 28, "y": 0}, {"x": 40, "y": -1}, {"x": 40, "y": -8}, {"x": 28, "y": -8}]}
  ],
  "MainPlatform": [
    {"id": "start_run", "closed": true, "points": [{"x": 0, "y": 0}, {"x": 12, "y": 0}, {"x": 16, "y": 2}, {"x": 16, "y": -3}, {"x": 0, "y": -3}]},
    {"id": "hill_descent", "closed": true, "points": [{"x": 16.02, "y": 2}, {"x": 22, "y": 5}, {"x": 28, "y": 0}, {"x": 28, "y": -3}, {"x": 16.02, "y": -3}]},
    {"id": "landing", "closed": true, "points": [{"x": 40, "y": -1}, {"x": 48, "y": 0}, {"x": 54, "y": 4}, {"x": 63, "y": 4}, {"x": 74, "y": 3}, {"x": 74, "y": -3}, {"x": 40, "y": -3}]}
  ],
  "RampPlatform": [
    {"id": "gap_kicker", "closed": false, "points": [{"x": 24, "y": 0}, {"x": 27, "y": 1}, {"x": 29, "y": 4}]},
    {"id": "air_arc", "closed": false, "points": [{"x": 46, "y": 6}, {"x": 49, "y": 9}, {"x": 53, "y": 8}, {"x": 56, "y": 5}]}
  ],
  "CheckPoint": [
    {"id": "cp_after_gap", "transform": {"x": 50, "y": 1, "rotation": 0}}
  ],
  "InteractableObject": [
    {"id": "breakaway", "type": "explosive_ramp", "points": [{"x": 8, "y": 1}, {"x": 11, "y": 2}]},
    {"id": "barrel_01", "type": "explosive_barrel", "transform": {"x": 20, "y": 6, "rotation": 0}, "properties": {"force": {"x": 7, "y": 12}}},
    {"id": "boost_01", "type": "speed_boost", "transform": {"x": 44, "y": 0}, "properties": {"durationSeconds": 3, "stackable": true}},
    {"id": "coin_high", "type": "coin", "transform": {"x": 49, "y": 11}}
  ]
}
